[
  {
    "id": "webapp_config",
    "impl": "perl",
    "compress": "False",
    "parsings": [
      {
        "path": "test_stats_dir",
        "files": "stats.txt",
        "vars": [
          {
            "id": "test_vector",
            "type": "vector",
            "vectorEntries": [
              "entry1",
              "entry2"
            ]
          }
        ]
      }
    ]
  }
]